{
  "$schema": "https://developer.microsoft.com/json-schemas/fabric/item/report/definition/report/3.2.0/schema.json",
  "themeCollection": {
    "baseTheme": {
      "name": "CY22SU11",
      "reportVersionAtImport": {
        "visual": "1.8.77",
        "report": "2.0.77",
        "page": "1.3.77"
      },
      "type": "SharedResources"
    },
    "customTheme": {
      "name": "Custom27014509200079306.json",
      "reportVersionAtImport": {
        "visual": "1.8.77",
        "report": "2.0.77",
        "page": "1.3.77"
      },
      "type": "RegisteredResources"
    }
  },
  "filterConfig": {
    "filters": [
      {
        "name": "Filter1a8dd2026e4e36274ec7",
        "ordinal": 0,
        "field": {
          "Column": {
            "Expression": {
              "SourceRef": {
                "Entity": "dimTimetable_Season"
              }
            },
            "Property": "Year_season"
          }
        },
        "type": "Categorical",
        "howCreated": "User",
        "objects": {
          "general": [
            {
              "properties": {}
            }
          ]
        }
      },
      {
        "name": "Filter0c080e4b1322eaba0f6b",
        "ordinal": 1,
        "field": {
          "Column": {
            "Expression": {
              "SourceRef": {
                "Entity": "dimTimetable_Season"
              }
            },
            "Property": "Season"
          }
        },
        "type": "Categorical",
        "howCreated": "User",
        "objects": {
          "general": [
            {
              "properties": {}
            }
          ]
        }
      },
      {
        "name": "Filter43b25e22162a5950ac9a",
        "ordinal": 2,
        "field": {
          "Column": {
            "Expression": {
              "SourceRef": {
                "Entity": "dimSub Agency"
              }
            },
            "Property": "Sub Agency"
          }
        },
        "type": "Categorical",
        "howCreated": "User",
        "objects": {
          "general": [
            {
              "properties": {}
            }
          ]
        }
      },
      {
        "name": "Filterceffa814ec63e8cd25d4",
        "ordinal": 3,
        "field": {
          "GroupRef": {
            "Expression": {
              "SourceRef": {
                "Entity": "dimVendor"
              }
            },
            "Property": "Offshore/Nearshore",
            "GroupedColumns": [
              {
                "Column": {
                  "Expression": {
                    "SourceRef": {
                      "Entity": "dimVendor"
                    }
                  },
                  "Property": "Sourcing Market"
                }
              }
            ]
          }
        },
        "type": "Categorical",
        "howCreated": "User"
      },
      {
        "name": "Filter714f07e8d5422d314b3a",
        "ordinal": 4,
        "field": {
          "GroupRef": {
            "Expression": {
              "SourceRef": {
                "Entity": "dimVendor"
              }
            },
            "Property": "Sourcing Market",
            "GroupedColumns": [
              {
                "Column": {
                  "Expression": {
                    "SourceRef": {
                      "Entity": "dimVendor"
                    }
                  },
                  "Property": "Sourcing Country"
                }
              }
            ]
          }
        },
        "type": "Categorical",
        "howCreated": "User"
      },
      {
        "name": "Filter2865fa4e3d9fb30ac8ad",
        "ordinal": 5,
        "field": {
          "Column": {
            "Expression": {
              "SourceRef": {
                "Entity": "dimVendor"
              }
            },
            "Property": "Sourcing Country"
          }
        },
        "type": "Categorical",
        "howCreated": "User"
      },
      {
        "name": "Filter21794651177af0b73934",
        "ordinal": 6,
        "field": {
          "Column": {
            "Expression": {
              "SourceRef": {
                "Entity": "dimVendor"
              }
            },
            "Property": "Vendor"
          }
        },
        "type": "Categorical",
        "howCreated": "User",
        "objects": {
          "general": [
            {
              "properties": {}
            }
          ]
        }
      },
      {
        "name": "Filter6f61545f5d5e4efcc4a3",
        "ordinal": 7,
        "field": {
          "Column": {
            "Expression": {
              "SourceRef": {
                "Entity": "dimManufacturer"
              }
            },
            "Property": "Manufacturer"
          }
        },
        "type": "Categorical",
        "howCreated": "User"
      },
      {
        "name": "Filter472025abe3f0b5d65c91",
        "ordinal": 8,
        "field": {
          "Column": {
            "Expression": {
              "SourceRef": {
                "Entity": "dimManufacturer"
              }
            },
            "Property": "Production Country ID"
          }
        },
        "type": "Categorical",
        "howCreated": "User"
      },
      {
        "name": "Filter81142fe12237faebdbcc",
        "ordinal": 9,
        "field": {
          "Column": {
            "Expression": {
              "SourceRef": {
                "Entity": "dimBrand"
              }
            },
            "Property": "Brand"
          }
        },
        "type": "Categorical",
        "howCreated": "User",
        "objects": {
          "general": [
            {
              "properties": {}
            }
          ]
        }
      },
      {
        "name": "Filter4853be03404a764225a2",
        "ordinal": 10,
        "field": {
          "Column": {
            "Expression": {
              "SourceRef": {
                "Entity": "dimGender"
              }
            },
            "Property": "Gender"
          }
        },
        "type": "Categorical",
        "howCreated": "User"
      },
      {
        "name": "Filter77448a9f1dcf977da76c",
        "ordinal": 11,
        "field": {
          "Column": {
            "Expression": {
              "SourceRef": {
                "Entity": "dimLine"
              }
            },
            "Property": "Line"
          }
        },
        "type": "Categorical",
        "howCreated": "User",
        "objects": {
          "general": [
            {
              "properties": {}
            }
          ]
        }
      },
      {
        "name": "Filter7806b486b6d21c8a074b",
        "ordinal": 12,
        "field": {
          "Column": {
            "Expression": {
              "SourceRef": {
                "Entity": "CPBI_MATERIAL"
              }
            },
            "Property": "Product Group"
          }
        },
        "type": "Categorical",
        "howCreated": "User"
      },
      {
        "name": "Filter273009b35303ea885fe7",
        "ordinal": 13,
        "field": {
          "Column": {
            "Expression": {
              "SourceRef": {
                "Entity": "dimMainClass"
              }
            },
            "Property": "Main Class"
          }
        },
        "type": "Categorical",
        "howCreated": "User"
      },
      {
        "name": "Filter9cf2059924ddf54c334a",
        "ordinal": 14,
        "field": {
          "Column": {
            "Expression": {
              "SourceRef": {
                "Entity": "dimClass"
              }
            },
            "Property": "Class"
          }
        },
        "type": "Categorical",
        "howCreated": "User"
      },
      {
        "name": "Filter40146e2c8562bce2f6dc",
        "ordinal": 15,
        "field": {
          "Column": {
            "Expression": {
              "SourceRef": {
                "Entity": "dimSubClass"
              }
            },
            "Property": "Sub Class"
          }
        },
        "type": "Categorical",
        "howCreated": "User"
      },
      {
        "name": "Filter806475335b830123d8a4",
        "ordinal": 16,
        "field": {
          "Column": {
            "Expression": {
              "SourceRef": {
                "Entity": "dimCollectionType"
              }
            },
            "Property": "Collection Type"
          }
        },
        "type": "Categorical",
        "howCreated": "User",
        "objects": {
          "general": [
            {
              "properties": {}
            }
          ]
        }
      },
      {
        "name": "Filterb60ec981203e41c40602",
        "ordinal": 17,
        "field": {
          "Column": {
            "Expression": {
              "SourceRef": {
                "Entity": "Details"
              }
            },
            "Property": "Purchase Order"
          }
        },
        "type": "Categorical",
        "howCreated": "User"
      },
      {
        "name": "Filter5a692c15ea111d22277f",
        "ordinal": 18,
        "field": {
          "Column": {
            "Expression": {
              "SourceRef": {
                "Entity": "CPBI_MATERIAL"
              }
            },
            "Property": "Style"
          }
        },
        "type": "Categorical",
        "howCreated": "User",
        "objects": {
          "general": [
            {
              "properties": {}
            }
          ]
        }
      },
      {
        "name": "Filter4d254f21424be77b7dce",
        "ordinal": 19,
        "field": {
          "Column": {
            "Expression": {
              "SourceRef": {
                "Entity": "CPBI_MATERIAL"
              }
            },
            "Property": "Retail Price (UVP) €"
          }
        },
        "type": "Categorical",
        "howCreated": "User"
      },
      {
        "name": "Filter3b3cf46afd45a5a049f1",
        "ordinal": 20,
        "field": {
          "GroupRef": {
            "Expression": {
              "SourceRef": {